Title,Author,ISBN,Edition,Year Published,Material,Category,Shelf No.,Total Stocks,No. of Borrower
To Kill a Mockingbird,Harper Lee,9.78006E+12,50th Anniversary Edition,1960,Print,Classic Fiction,CF001,5,10
1984,George Orwell,9.78045E+12,None,1949,Print,Science Fiction,SF002,3,6
Book A, Author X,1.23457E+12, 1st Edition,2020, Paperback, Fiction, Shelf 1,10,5
Book B, Author Y,9.87654E+12, 2nd Edition,2018, Hardcover, Mystery, Shelf 2,5,3
Book C, Author Z,2.46814E+12, 3rd Edition,2019, Paperback, Science Fiction, Shelf 3,8,2
Harry Potter and the Sorcerer's Stone,J.K. Rowling,9.78059E+12,None,1997,Print,Fantasy,FT006,10,20
The Da Vinci Code,Dan Brown,9.78031E+12,None,2003,Print,Mystery,MYS010,4,8
The Lord of the Rings,J.R.R. Tolkien,9.78054E+12,None,1954,Print,Fantasy,FT009,5,10
Harry Potter and the Goblet of Fire,J.K. Rowling,5.36158E+12,None,2000,Print,Fantasy,FT007,5,5
